{
  "schema_version": "0.1",
  "original_sha256": "fe504e9b7676ae389d1a2c4fc3d233ead84ca66422f3f7ff792969808040648b",
  "candidate_sha256": "09fb340b31ee8f74f50bb878bf68baccb800df689ef7b473dcb414b218ad9613",
  "target_rules": [
    "mesh.degenerate_triangles"
  ],
  "resolved_target_rules": [
    "mesh.degenerate_triangles"
  ],
  "unresolved_target_rules": [],
  "new_error_findings": [
    {
      "finding_id": "f-0001",
      "rule_id": "package.valid_glb",
      "severity": "ERROR",
      "message": "header declares 636 bytes but file contains 652",
      "location": {},
      "observed": "LENGTH_MISMATCH",
      "expected": "valid GLB 2.0",
      "evidence": {},
      "repairability": "MANUAL_ONLY",
      "confidence": 1.0
    }
  ],
  "required_checks_complete": false,
  "repair_attempted": true,
  "gate_state": "FAILED_ROLLBACK"
}
